{
  "schema": "lecture_notes.v1",
  "video_id": "python_l1",
  "outline": [
    {
      "section_id": 1,
      "title": "How to succeed in 6.0001",
      "gist": "Practice, download the code, do the problem sets.",
      "weak_points": [
        "u0p0"
      ]
    },
    {
      "section_id": 2,
      "title": "What a computer does",
      "gist": "Calculations and memory; two kinds of knowledge.",
      "weak_points": []
    }
  ],
  "glossary": [
    {
      "term": "declarative knowledge",
      "definition": "Statements of fact.",
      "t": 520.0
    }
  ],
  "questions": [
    {
      "question": "What are the two things a computer does?",
      "answer": "It calculates and remembers results.",
      "section_id": 2,
      "t": 420.0
    }
  ],
  "generator": "llm",
  "model": "openai/gpt-oss-120b",
  "agent_ms": 2400.0,
  "quality_flags": [],
  "ended_by": "last_window",
  "created_ts": 1792053000000
}
